{"$schema":"https://json-schema.org/draft/2020-12/schema","type":"object","required":["schema_version","generated_at","overview","vuln_monthly_trend","permission_category_distribution"],"properties":{"schema_version":{"const":"1.0"},"generated_at":{"type":"string"},"overview":{"type":"object","required":["total_apps","total_apk_versions","total_cves","bulletin_months","avg_dangerous_permissions","avg_clri","high_risk_apps_count","apps_with_drift_count"]},"vuln_monthly_trend":{"type":"array"},"permission_category_distribution":{"type":"array"}}}
