{
  "schema_version": "1.0",
  "generated_at": "2026-06-11T16:00:37.161651+00:00",
  "overview": {
    "total_apps": 3,
    "total_apk_versions": 9,
    "total_cves": 3,
    "bulletin_months": 3,
    "avg_dangerous_permissions": 1.78,
    "avg_clri": 3.51,
    "high_risk_apps_count": 0,
    "apps_with_drift_count": 3
  },
  "vuln_monthly_trend": [
    {
      "month": "2024-06",
      "critical": 0,
      "high": 1,
      "moderate": 0,
      "low": 0
    },
    {
      "month": "2024-11",
      "critical": 1,
      "high": 0,
      "moderate": 0,
      "low": 0
    },
    {
      "month": "2025-03",
      "critical": 0,
      "high": 0,
      "moderate": 1,
      "low": 0
    }
  ],
  "permission_category_distribution": [
    {
      "category": "Development",
      "permission_count": 5,
      "avg_dangerous": 1.67
    },
    {
      "category": "Internet",
      "permission_count": 0,
      "avg_dangerous": 0.0
    },
    {
      "category": "Multimedia",
      "permission_count": 6,
      "avg_dangerous": 2.33
    },
    {
      "category": "Navigation",
      "permission_count": 0,
      "avg_dangerous": 0.0
    },
    {
      "category": "Reading",
      "permission_count": 5,
      "avg_dangerous": 1.33
    }
  ]
}
